{
  "canonical_utf8_hex": "7b2273223a2271756f74655c2220736c6173682f206261636b736c6173685c5c20636f6e74726f6c733a5c625c745c6e5c665c725c7530303031227d0a",
  "profile_id": "admission_canonical_json_v1",
  "sha256_digest": "sha256:97e43725f85615c7276b0ac868e39b5a7d8d823409d2949843924b02abfab5c8",
  "value": {
    "s": "quote\" slash/ backslash\\ controls:\b\t\n\f\r\u0001"
  },
  "vector_id": "string-escapes"
}
